{
  "spec_version": "1.0.0",
  "experiment_id": "env-sensors-pilot-001",
  "epoch_index": 0,
  "cohort_id": "u4pruy",
  "time_range": {
    "start": 1721001600,
    "end": 1721088000
  },
  "signer_set_commitment": {
    "algo": "sha256",
    "merkle_root_hex": "a1b2c3d4e5f60718293a4b5c6d7e8f90112233445566778899aabbccddeeff0a",
    "signer_count": 42,
    "leaf_scheme": "sha256(0x00||'signer'||signer_pubkey_be32)"
  },
  "observations_commitment": {
    "algo": "sha256",
    "merkle_root_hex": "0f1e2d3c4b5a69788796a5b4c3d2e1f00112233445566778899aabbccddeef11",
    "leaf_count": 9840,
    "leaf_scheme": "sha256(0x00||'obs'||observation_commitment_be32)"
  },
  "aggregate_summary": {
    "accepted_count": 9720,
    "rejected_count": 120,
    "distinct_signers": 42,
    "quality_score_micro_sum": 8931420000
  },
  "batch_signature": {
    "algo": "ed25519",
    "signer_pubkey": "CoorD1111111111111111111111111111111111111",
    "header_hash_hex": "c0ffee00c0ffee11c0ffee22c0ffee33c0ffee44c0ffee55c0ffee66c0ffee77",
    "signature_hex": "11223344556677889900aabbccddeeff11223344556677889900aabbccddeeff11223344556677889900aabbccddeeff11223344556677889900aabbccddeeff"
  }
}
